"Rank","Player","Pos","Tm","Pos Rank","Silva Comments","Rank Change","ADP ESPN","ADP Delta","PosADP Delta"
"1","Jahmyr Gibbs","RB","DET","RB01","50+ catches in back-to-back seasons. 20 all-purpose TDs in ‘24.","0","5.4","4.4","2"
"2","Bijan Robinson","RB","ATL","RB02","5 years younger than Saquon. Falcons profile as shootout team.","2","3.3","1.3","-1"
"3","Ja'Marr Chase","WR","CIN","WR01","Led NFL in catches, rec yds, rec TDs in ’24. Turned 25 in March.","-1","1.6","-1.4","0"
"4","CeeDee Lamb","WR","DAL","WR02","Fantasy’s overall WR1 in last full season with Dak Prescott (‘23).","-1","7.3","3.3","1"
"5","Saquon Barkley","RB","PHI","RB03","Fading 2024’s No. 1 fantasy difference-maker after 482 touches.","0","3.5","-1.5","-1"
"6","Justin Jefferson","WR","MIN","WR03","Unproven QB; Confidence comes from talent &amp; KOC’s system.","0","4.1","-1.9","-1"
"7","Ashton Jeanty","RB","LV","RB04","Pete Carroll/Chip Kelly will feed MJD-level talent relentlessly.","0","10.8","3.8","1"
"8","Brian Thomas Jr.","WR","JAX","WR04","Freak athlete ranked 6th in NFL in yards per route run as rookie.","0","19.7","11.7","5"
"9","Amon-Ra St. Brown","WR","DET","WR05","Slot machine averaging 6.9 catches per game last 3 seasons.","0","11.2","2.2","0"
"10","De'Von Achane","RB","MIA","RB05","Avg’d 22.6 PPR PPG with Tua Tagovailoa in lineup last season.","0","14.2","4.2","2"
"11","Nico Collins","WR","HOU","WR06","98/1,503/10 last 17 reg season games. CJ Stroud's clear alpha.","0","17.1","6.1","1"
"12","Puka Nacua","WR","LA","WR07","111/1,552/6 last 17 reg season games. Davante Adams aboard.","0","8.9","-3.1","-3"
"13","Christian McCaffrey","RB","SF","RB06","Obv injury risk but overall RB1 finish still in range of outcomes.","0","9.2","-3.8","-2"
"14","Drake London","WR","ATL","WR08","7.3/117.3/0.7 receiving avg in Michael Penix’s three ’24 starts.","0","26.3","12.3","2"
"15","Malik Nabers","WR","NYG","WR09","Giants will revolve O around Nabers and play from behind.","0","12.9","-2.1","-3"
"16","Chase Brown","RB","CIN","RB07","Elite offense. Avg’d 23.6 touches, 116.3 yds, 0.8 TD last 8 games.","0","36.1","20.1","6"
"17","Brock Bowers","TE","LV","TE01","Won 2 Mackeys in college. Huge diff maker, in his own TE tier.","0","20.2","3.2","0"
"18","Ladd McConkey","WR","LAC","WR10","Insta-separator in slot. 4th in NFL in yards/route run as rookie.","0","29.9","11.9","2"
"19","A.J. Brown","WR","PHI","WR11","Age-28 season. Including playoffs, 79/1,242/9 in 17 games last yr.","0","18.9","-0.1","-3"
"20","Derrick Henry","RB","BAL","RB08","Still rolling but will be 31 ½ by Week 1, minimal pass-game role.","0","13.2","-6.8","-2"
"21","Jonathan Taylor","RB","IND","RB09","True week winner when healthy. Overall RB1 last Weeks 15-18.","0","16.4","-4.6","-1"
"22","Bucky Irving","RB","TB","RB10","All-purpose tackle breaker locked in as lead back in loaded O.","0","22.1","0.1","0"
"23","Jaxon Smith-Njigba","WR","SEA","WR12","New QB &amp; offense after breakout 100-catch campaign.","0","42.1","19.1","4"
"24","Tee Higgins","WR","CIN","WR13","Bengals profile as shootout team. Last 17 games: 88/1,239/13.","0","29.6","5.6","-2"
"25","Davante Adams","WR","LA","WR14","Turns 33 late in season but ideal stylistic match w/ Stafford.","0","37.3","12.3","0"
"26","Josh Jacobs","RB","GB","RB11","Packers brought in no competition for versatile 340-touch horse.","0","19.5","-6.5","-2"
"27","Tyreek Hill","WR","MIA","WR15","Scary pick. Off-field flags, production decline, advancing age (31).","0","32.2","5.2","-2"
"28","Lamar Jackson","QB","BAL","QB01","Year 3 of Todd Monken. 1st, 2nd in NFL MVP voting in first two.","0","23.2","-4.8","1"
"29","Josh Allen","QB","BUF","QB02","Always in overall QB1 hunt; weapons just not as strong as Lamar’s.","0","21.8","-7.2","-1"
"30","Jameson Williams","WR","DET","WR16","Gamebreaker’s role slated to grow after huge 2024 step.","0","84.5","54.5","15"
"31","Mike Evans","WR","TB","WR17","32 in August. Including playoffs, his last 17 games: 92/1,291/13.","0","48.0","17.0","0"
"32","James Cook","RB","BUF","RB12","Lead RB in elite offense. Contract szn. 18 TD in 16 games last yr.","0","27.9","-4.1","0"
"33","Kyren Williams","RB","LA","RB13","Inefficiency increasingly alarming. Still has Sean McVay’s trust.","0","24.4","-8.6","-2"
"34","Omarion Hampton","RB","LAC","RB14","Chargers made Hampton 22nd overall pick. Najee Harris a big ?","0","48.8","14.8","4"
"35","Marvin Harrison Jr.","WR","ARI","WR18","Classic sophomore buy after underwhelming rookie campaign.","0","48.5","13.5","0"
"36","George Pickens","WR","DAL","WR19","Contract yr. Dallas’ perimeter pass game belongs to Pickens.","12","74.2","38.2","9"
"37","Jaylen Waddle","WR","MIA","WR20","Fins O among NFL's most concentrated. Can he pass Tyreek as WR1?","-1","80.7","43.7","9"
"38","Garrett Wilson","WR","NYJ","WR21","Jets going run heavy, but Wilson will dominate Justin Fields’ eye.","-1","51.6","13.6","-2"
"39","Breece Hall","RB","NYJ","RB15","Once-dynamic playmaker now 2 seasons removed from ACL tear.","-1","44.0","5.0","1"
"40","George Kittle","TE","SF","TE02","No Deebo. Aiyuk recovering. Kittle best all-around TE in league.","-1","38.6","-1.4","1"
"41","Trey McBride","TE","ARI","TE03","111 catches in ’24 ranked fourth in league regardless of position.","-1","28.0","-13.0","-1"
"42","Jalen Hurts","QB","PHI","QB03","52 rush TDs last 4 seasons. Tush Push here to stay, for now.","-1","34.3","-7.7","1"
"43","Jayden Daniels","QB","WAS","QB04","Arguably best rookie QB season in history. Was QB6 in fantasy.","-1","28.7","-14.3","-1"
"44","Terry McLaurin","WR","WAS","WR22","5 straight 1,000+ yd seasons. High-floor, questionable ceiling.","-1","40.1","-3.9","-7"
"45","Zay Flowers","WR","BAL","WR23","Ravens WR1 but ceiling questionable in widely-distributed O.","-1","69.2","24.2","1"
"46","Chuba Hubbard","RB","CAR","RB16","Workmanlike bellcow in ascending offense with elite O-Line.","-1","54.8","8.8","3"
"47","Courtland Sutton","WR","DEN","WR24","Returns as Broncos clear-cut WR1 after riffing with Bo Nix.","-1","69.4","22.4","1"
"48","Chris Olave","WR","NO","WR25","Concussion history, rookie QB render Olave screaming value.","-1","98.4","50.4","12"
"49","Xavier Worthy","WR","KC","WR26","R. Rice suspension fuels Worthy to build on promising rookie yr.","0","57.2","8.2","-3"
"50","Calvin Ridley","WR","TEN","WR27","Fave for WR1 treatment with No. 1 overall pick Cam Ward.","0","83.4","33.4","3"
"51","DK Metcalf","WR","PIT","WR28","Rough-around-edges talent enters run-dominant Steelers O.","0","55.3","4.3","-7"
"52","Tet McMillan","WR","CAR","WR29","Clear path to Bryce Young’s WR1 as 2025’s No. 8 overall pick.","0","91.7","39.7","5"
"53","Rashee Rice","WR","KC","WR30","Expecting 4-6 game suspension after guilty plea to two felonies.","0","54.5","1.5","-10"
"54","DeVonta Smith","WR","PHI","WR31","Elite player. Run-first O, top-shelf DEF curb box-score ceiling.","0","69.8","15.8","-5"
"55","Travis Hunter","WR","JAX","WR32","Actual generational talent with TBD role behind Brian Thomas.","0","72.1","17.1","-5"
"56","Alvin Kamara","RB","NO","RB17","30 in July. Still virtually no competition after renaissance year.","0","44.5","-11.5","0"
"57","Joe Mixon","RB","HOU","RB18","Avg’d 20.1 touches in first season with HOU. Feature back role safe.","0","37.6","-19.4","-4"
"58","James Conner","RB","ARI","RB19","Just turned 30. Cards made zero notable offseason RB adds.","0","54.9","-3.1","1"
"59","Kenneth Walker III","RB","SEA","RB20","Explosive but boom-busty back entering revised Seattle O.","0","41.6","-17.4","-5"
"60","Tony Pollard","RB","TEN","RB21","Tyjae Spears is lone competition for Pollard’s backfield work.","0","84.5","24.5","6"
"61","TreVeyon Henderson","RB","NE","RB22","HR-hitting part of tandem w/ Rhamondre Stevenson.","0","88.1","27.1","7"
"62","D'Andre Swift","RB","CHI","RB23","Bears punted RB upgrades. Swift knows Ben Johnson from DET.","0","71.6","9.6","0"
"63","DJ Moore","WR","CHI","WR33","Exhibited alarming lack of chemistry with Caleb Williams in ‘24.","0","56.3","-6.7","-11"
"64","Joe Burrow","QB","CIN","QB05","Bengals my favorite to lead league in points scored this year.","0","39.1","-24.9","0"
"65","Isiah Pacheco","RB","KC","RB24","Broke fibula last Week 2. Repositioned for Chiefs top RB job.","0","84.2","19.2","2"
"66","Ricky Pearsall","WR","SF","WR34","Year-2 breakout appeal with Deebo gone, Aiyuk recovering.","0","122.6","56.6","12"
"67","Jauan Jennings","WR","SF","WR35","Real shot to secure 49ers WR1 job after breakout campaign.","0","106.6","39.6","5"
"68","Deebo Samuel","WR","WAS","WR36","Excellent fit for Kliff Kingsbury O. Declining? Turned 29 in Jan.","0","102.4","34.4","3"
"69","Chris Godwin","WR","TB","WR37","On fire before ’24 ankle injury. Concern over injury recovery.","0","110.2","41.2","7"
"70","Jaylen Warren","RB","PIT","RB25","Not unrealistic PIT simply trusts Warren over Kaleb Johnson.","0","106.4","36.4","8"
"71","Kaleb Johnson","RB","PIT","RB26","Steelers talking up 3rd-round rookie as volume RB right away.","0","85.2","14.2","2"
"72","David Montgomery","RB","DET","RB27","Expect Lions to lean more into Jahmyr Gibbs in revised O.","0","61.0","-11.0","-6"
"73","RJ Harvey","RB","DEN","RB28","60th overall pick entering convoluted Broncos backfield.","0","67.5","-5.5","-6"
"74","Jayden Reed","WR","GB","WR38","Slumped as soph. Still most secure role in Packers WR rotation.","0","125.0","51.0","9"
"75","Sam LaPorta","TE","DET","TE04","Took step back from 2023 rookie year, still finished as fantasy TE6.","0","48.4","-26.6","0"
"76","Mark Andrews","TE","BAL","TE05","11 TDs over Ravens final 12 reg season games. Has Lamar trust.","0","82.7","6.7","3"
"77","Jakobi Meyers","WR","LV","WR39","By far Raiders most established wideout. Big QB upgrade.","0","109.9","32.9","4"
"78","Rome Odunze","WR","CHI","WR40","Sophomore buy after disappointing rookie yr. Was top-10 pick.","0","87.0","9.0","-8"
"79","Jordan Addison","WR","MIN","WR41","In-season suspension risk. New QB, heavy target comp.","0","99.2","20.2","-3"
"80","T.J. Hockenson","TE","MIN","TE06","Distanced from ‘23 ACL/MCL tear. New QB, heavy target comp.","0","61.1","-18.9","-1"
"81","Justin Fields","QB","NYJ","QB06","Can run for 1,000+ yards if healthy. Zero threat to his starting job.","0","130.5","49.5","6"
"82","Patrick Mahomes","QB","KC","QB07","Has been FF bust last two years. Rashee Rice suspension hurts.","0","56.5","-25.5","-1"
"83","Jerry Jeudy","WR","CLE","WR42","Badly needs Joe Flacco to win Browns 4-man quarterback derby.","0","87.8","4.8","-9"
"84","Emeka Egbuka","WR","TB","WR43","19th overall pick. Godwin off major injury. Evans 32 in August.","0","139.7","55.7","8"
"85","Darnell Mooney","WR","ATL","WR44","Complementary piece but Falcons look like shootout team.","0","129.9","44.9","5"
"86","Josh Downs","WR","IND","WR45","Arguably Colts best pure WR when healthy. Huge QB concerns.","0","160.1","74.1","9"
"87","Aaron Jones","RB","MIN","RB29","Vikings traded for Jordan Mason to take carries off Jones’ plate.","0","76.9","-10.1","-4"
"88","Travis Kelce","TE","KC","TE07","Age-36 season. R. Rice suspension big boon to box-score outlook.","0","64.1","-23.9","-1"
"89","Travis Etienne","RB","JAX","RB30","Spring reports suggested Etienne is fave to open as Jaguars RB1.","0","117.2","28.2","6"
"90","Christian Kirk","WR","HOU","WR46","Slot machine will provide interior safety valve for C.J. Stroud.","0","169.1","79.1","14"
"91","Stefon Diggs","WR","NE","WR47","Great landing spot but tore ACL last Week 8, turns 32 in Nov.","0","108.0","17.0","-6"
"92","Kyler Murray","QB","ARI","QB08","Has never topped 26 TD passes. Dual threat supports solid floor.","0","99.3","7.3","1"
"93","Brian Robinson","RB","WAS","RB31","Favorite for carries/GL work in upward-trending WAS attack.","0","104.8","11.8","0"
"94","Jordan Mason","RB","MIN","RB32","Outside shot to emerge as Vikes lead back after trade from SF.","0","139.8","45.8","10"
"95","J.K. Dobbins","RB","DEN","RB33","Realistic chance to lead Broncos backfield in touches.","0","148.1","53.1","11"
"96","Cam Skattebo","RB","NYG","RB34","Better inside runner, goal-line RB, pass pro than Tyrone Tracy.","0","105.3","9.3","-2"
"97","Tyler Warren","TE","IND","TE08","’24 Mackey Award winner benefits if Colts start Daniel Jones.","0","132.3","35.3","3"
"98","Jake Ferguson","TE","DAL","TE09","Was fantasy TE9, drew 102 targets in Dak’s last full season (‘23).","0","160.1","62.1","5"
"99","Keon Coleman","WR","BUF","WR48","Josh Allen’s highest-ceiling wideout struggles to separate.","0","117.4","18.4","-3"
"100","Khalil Shakir","WR","BUF","WR49","Possession-WR ceiling but Josh Allen’s most trusted target.","0","109.0","9.0","-7"
"101","Michael Pittman","WR","IND","WR50","Strict possession WR requires heavy target vol for FF usefulness.","0","125.5","24.5","-2"
"102","Jaydon Blue","RB","DAL","RB35","Upside bet. Dynamic. Battling Javonte Williams/Miles Sanders.","0","148.7","46.7","10"
"103","Matthew Golden","WR","GB","WR51","Rookie will get first crack at Packers top perimeter WR job.","0","94.8","-8.2","-15"
"104","Luther Burden III","WR","CHI","WR52","Handpicked by Ben Johnson. Explosive playmaker in slot.","0","166.1","62.1","5"
"105","Marquise Brown","WR","KC","WR53","Nice on-paper situation but hasn't been FF useful since 2021. ","0","154.0","49.0","-1"
"106","Bhayshul Tuten","RB","JAX","RB36","4.3 gamebreaker. Only Travis Etienne, Tank Bigsby to pass.","0","146.0","40.0","7"
"107","Rhamondre Stevenson","RB","NE","RB37","TreVeyon Henderson pick kills Rhamondre’s upside.","0","106.6","-0.4","-3"
"108","Zach Charbonnet","RB","SEA","RB38","Kenneth Walker more talented, but new offense in Seattle.","0","125.5","17.5","0"
"109","Tyrone Tracy Jr.","RB","NYG","RB39","I'm betting Cam Skattebo quickly asserts self as Giants main RB.","0","108.1","-0.9","-4"
"110","Tank Bigsby","RB","JAX","RB40","Jags best runner in ’24 but limited skill set &amp; new regime in JAX.","0","134.9","24.9","1"
"111","Austin Ekeler","RB","WAS","RB41","Commanders change-up/pass-dn RB behind Brian Robinson.","0","118.5","7.5","-4"
"112","Jerome Ford","RB","CLE","RB42","Efficient and versatile. Stock rose with Quinshon Judkins' arrest.","0","166.5","54.5","9"
"113","Tyjae Spears","RB","TEN","RB43","Outplayed by Tony Pollard in 2024 but still firmly Titans RB2.","0","130.1","17.1","-4"
"114","Trey Benson","RB","ARI","RB44","66th overall pick in 2024. Bet against 30-year-old James Conner.","0","160.5","46.5","4"
"115","Isaac Guerendo","RB","SF","RB45","A bet against Christian McCaffrey health. 5.0 YPC as rookie.","0","152.3","37.3","1"
"116","Javonte Williams","RB","DAL","RB46","Looked washed in ’24 but Cowboys RB depth chart open.","0","99.4","-16.6","-16"
"117","Will Shipley","RB","PHI","RB47","Sleeper to be league winner should Saquon Barkley go down.","0","169.7","52.7","9"
"118","Quinshon Judkins","RB","CLE","RB48","Browns 2nd-rounder arrested in July for battery/domestic violence.","0","74.8","-43.2","-24"
"119","Blake Corum","RB","LA","RB49","2024 third-round pick. Kyren Williams low on efficiency.","0","169.2","50.2","3"
"120","Caleb Williams","QB","CHI","QB09","Big coaching &amp; OL upgrades. Was fantasy’s QB16 as rookie.","0","119.9","-0.1","1"
"121","Trevor Lawrence","QB","JAX","QB10","Big coach, WR upgrades. Can run. Long-awaited breakout?","0","168.3","47.3","5"
"122","Justin Herbert","QB","LAC","QB11","Sleeper MVP bet in Year 2 of Jim Harbaugh &amp; Greg Roman.","0","122.2","0.2","0"
"123","Bo Nix","QB","DEN","QB12","Ran for 430 yards as rookie. Elite offensive line &amp; scheme.","0","77.5","-45.5","-4"
"124","Baker Mayfield","QB","TB","QB13","Loaded pass-catcher corps. Bucs profile as shootout team.","0","76.1","-47.9","-6"
"125","Rashod Bateman","WR","BAL","WR54","Quietly coming off career-best season. Stayed healthy.","0","167.5","42.5","4"
"126","Cooper Kupp","WR","SEA","WR55","Tank running on E but has secure role in Seahawks 3-WR set.","0","93.4","-32.6","-20"
"127","Roschon Johnson","RB","CHI","RB50","Bears RB room open but entirely new staff in Chicago.","0","166.4","39.4","0"
"128","Ray Davis","RB","BUF","RB51","Year 2 for Joe Brady favorite behind disgruntled James Cook.","0","164.7","36.7","-2"
"129","Tyler Allgeier","RB","ATL","RB52","Overall RB1 upside should something happen to Bijan Robinson.","0","156.4","27.4","-5"
"130","MarShawn Lloyd","RB","GB","RB53","2024 third-rounder’s rookie season torpedoed by injuries.","0","169.8","39.8","4"
"131","Braelon Allen","RB","NYJ","RB54","Trade rumors around Breece Hall. Allen is Jets next RB up.","0","169.5","38.5","-1"
"132","Rachaad White","RB","TB","RB55","Lapped by Bucky Irving in '24 but can reemerge w/ Irving injury.","0","131.5","-0.5","-15"
"133","Jaylen Wright","RB","MIA","RB56","Dynamic but mistake prone behind smallish De’Von Achane.","0","169.6","36.6","-2"
"134","Tucker Kraft","TE","GB","TE10","Remember Luke Musgrave? Kraft has lapped him as Packers TE.","0","129.6","-4.4","0"
"135","Dallas Goedert","TE","PHI","TE11","Eagles run-first O, star WR duo curb Goedert’s projections.","0","141.1","6.1","2"
"136","Kyle Pitts","TE","ATL","TE12","Frustrating underachiever, but ATL should be involved in shootouts.","0","164.3","28.3","4"
"137","David Njoku","TE","CLE","TE13","QB questions. Browns spent third-rounder on TE Harold Fannin.","0","80.3","-56.7","-6"
"138","Brandon Aiyuk","WR","SF","WR56","Mercurial talent won’t be ready Week 1 after ACL/MCL tear.","0","160.8","22.8","-1"
"139","Tre Harris","WR","LAC","WR57","55th overall pick got bump when Mike Williams retired.",,"161.0","22.0","-1"
"140","Darius Slayton","WR","NYG","WR58","Can get behind the D, which is where Russell Wilson wins.","0","170.0","30.0","3"
"141","Dalton Kincaid","TE","BUF","TE14","Year-3 breakout candidate for Bills team lacking alpha WR.","0","133.0","-8.0","-2"
"142","DeAndre Hopkins","WR","BAL","WR59","Age-33 season. Signs point to Hopkins having little left.","0","168.8","26.8","0"
"143","Drake Maye","QB","NE","QB14","Flashed Josh Allen similarities as rookie. Absolute beast runner.","0","151.1","8.1","-1"
"144","Matthew Stafford","QB","LA","QB15","Added Davante Adams, Rams offensive line now settled.","0","164.8","20.8","-1"
"145","Xavier Legette","WR","CAR","WR60","Gadget type failed to clear 500 yards in 16 games last year.","0","157.3","12.3","-7"
"146","Isaiah Likely","TE","BAL","TE15","Role-player weapon would explode with Mark Andrews injury.","0","161.1","15.1","0"
"147","Jonnu Smith","TE","PIT","TE16","Big downgrade going from Miami to run-first Pittsburgh.","0","120.3","-26.7","-7"
"148","Jayden Higgins","WR","HOU","WR61","34th overall pick should bookend Nico Collins in 2-WR sets.","0","136.0","-12.0","-11"
"149","Rico Dowdle","RB","CAR","RB57","Lead RB in favorable environment if Chuba Hubbard gets hurt.","0","169.6","20.6","-2"
"150","Jaleel McLaughlin","RB","DEN","RB58","5’8/187-pound role player damaged by R.J. Harvey pick.","0","170.0","20.0","0"
